<?xml version="1.0" encoding="UTF-8"?>
<?xml-stylesheet type="text/xsl" href="data.xsl"?>
<computers
	xmlns:xsi="http://www.w3.org/2001/XMLSchema-instance"
	xsi:noNamespaceSchemaLocation="data.xsd">
	<computer>
		<monitor>
			<width>0.0</width>
			<height>0.0</height>
			<name>name monitor here 1</name>
		</monitor>
		<keyboard>
			<name>name keyboard here</name>
			<countKeys>140</countKeys>
		</keyboard>
		<mouse>
			<name>name mouse here</name>
			<isWireless>0</isWireless>
			<countButtons>3</countButtons>
		</mouse>
		<systemBlock>
			<name>name system block here</name>
			<width>0.0</width>
			<height>0.0</height>
			<weigth>0.0</weigth>
			<innerSystemBlock>
				<motherboard>
					<name>name motherboard here</name>
					<formFactor>name form factor here</formFactor>
					<slots>6</slots>
					<connectors>4</connectors>
				</motherboard>
				<videoCard>
					<cpu>name cpu here</cpu>
					<coreClockSpeed>0.0</coreClockSpeed>
					<memoryType>name memoryType here</memoryType>
					<memorySize>4</memorySize>
				</videoCard>
			</innerSystemBlock>
		</systemBlock>
	</computer>
	<computer>
		<monitor>
			<width>0.0</width>
			<height>0.0</height>
			<name>name monitor here 2</name>
		</monitor>
		<keyboard>
			<name>name keyboard here</name>
			<countKeys>140</countKeys>
		</keyboard>
		<mouse>
			<name>name mouse here</name>
			<isWireless>0</isWireless>
			<countButtons>3</countButtons>
		</mouse>
		<systemBlock>
			<name>name system block here</name>
			<width>0.0</width>
			<height>0.0</height>
			<weigth>0.0</weigth>
			<innerSystemBlock>
				<motherboard>
					<name>name motherboard here</name>
					<formFactor>name form factor here</formFactor>
					<slots>6</slots>
					<connectors>4</connectors>
				</motherboard>
				<videoCard>
					<cpu>name cpu here</cpu>
					<coreClockSpeed>0.0</coreClockSpeed>
					<memoryType>name memoryType here</memoryType>
					<memorySize>4</memorySize>
				</videoCard>
			</innerSystemBlock>
		</systemBlock>
	</computer>
	<computer>
		<monitor>
			<width>0.0</width>
			<height>0.0</height>
			<name>name monitor here 2</name>
		</monitor>
		<keyboard>
			<name>name keyboard here</name>
			<countKeys>140</countKeys>
		</keyboard>
		<mouse>
			<name>name mouse here</name>
			<isWireless>0</isWireless>
			<countButtons>3</countButtons>
		</mouse>
		<systemBlock>
			<name>name system block here</name>
			<width>0.0</width>
			<height>0.0</height>
			<weigth>0.0</weigth>
			<innerSystemBlock>
				<motherboard>
					<name>name motherboard here</name>
					<formFactor>name form factor here</formFactor>
					<slots>6</slots>
					<connectors>4</connectors>
				</motherboard>
				<videoCard>
					<cpu>name cpu here</cpu>
					<coreClockSpeed>0.0</coreClockSpeed>
					<memoryType>name memoryType here</memoryType>
					<memorySize>4</memorySize>
				</videoCard>
			</innerSystemBlock>
		</systemBlock>
	</computer>
	<computer>
		<monitor>
			<width>0.0</width>
			<height>0.0</height>
			<name>name monitor here 2</name>
		</monitor>
		<keyboard>
			<name>name keyboard here</name>
			<countKeys>140</countKeys>
		</keyboard>
		<mouse>
			<name>name mouse here</name>
			<isWireless>0</isWireless>
			<countButtons>3</countButtons>
		</mouse>
		<systemBlock>
			<name>name system block here</name>
			<width>0.0</width>
			<height>0.0</height>
			<weigth>0.0</weigth>
			<innerSystemBlock>
				<motherboard>
					<name>name motherboard here</name>
					<formFactor>name form factor here</formFactor>
					<slots>6</slots>
					<connectors>4</connectors>
				</motherboard>
				<videoCard>
					<cpu>name cpu here</cpu>
					<coreClockSpeed>0.0</coreClockSpeed>
					<memoryType>name memoryType here</memoryType>
					<memorySize>4</memorySize>
				</videoCard>
			</innerSystemBlock>
		</systemBlock>
	</computer>
	<computer>
		<monitor>
			<width>0.0</width>
			<height>0.0</height>
			<name>name monitor here 2</name>
		</monitor>
		<keyboard>
			<name>name keyboard here</name>
			<countKeys>140</countKeys>
		</keyboard>
		<mouse>
			<name>name mouse here</name>
			<isWireless>0</isWireless>
			<countButtons>3</countButtons>
		</mouse>
		<systemBlock>
			<name>name system block here</name>
			<width>0.0</width>
			<height>0.0</height>
			<weigth>0.0</weigth>
			<innerSystemBlock>
				<motherboard>
					<name>name motherboard here</name>
					<formFactor>name form factor here</formFactor>
					<slots>6</slots>
					<connectors>4</connectors>
				</motherboard>
				<videoCard>
					<cpu>name cpu here</cpu>
					<coreClockSpeed>0.0</coreClockSpeed>
					<memoryType>name memoryType here</memoryType>
					<memorySize>4</memorySize>
				</videoCard>
			</innerSystemBlock>
		</systemBlock>
	</computer>
	<computer>
		<monitor>
			<width>0.0</width>
			<height>0.0</height>
			<name>name monitor here 2</name>
		</monitor>
		<keyboard>
			<name>name keyboard here</name>
			<countKeys>140</countKeys>
		</keyboard>
		<mouse>
			<name>name mouse here</name>
			<isWireless>0</isWireless>
			<countButtons>3</countButtons>
		</mouse>
		<systemBlock>
			<name>name system block here</name>
			<width>0.0</width>
			<height>0.0</height>
			<weigth>0.0</weigth>
			<innerSystemBlock>
				<motherboard>
					<name>name motherboard here</name>
					<formFactor>name form factor here</formFactor>
					<slots>6</slots>
					<connectors>4</connectors>
				</motherboard>
				<videoCard>
					<cpu>name cpu here</cpu>
					<coreClockSpeed>0.0</coreClockSpeed>
					<memoryType>name memoryType here</memoryType>
					<memorySize>4</memorySize>
				</videoCard>
			</innerSystemBlock>
		</systemBlock>
	</computer>
	<computer>
		<monitor>
			<width>0.0</width>
			<height>0.0</height>
			<name>name monitor here 2</name>
		</monitor>
		<keyboard>
			<name>name keyboard here</name>
			<countKeys>140</countKeys>
		</keyboard>
		<mouse>
			<name>name mouse here</name>
			<isWireless>0</isWireless>
			<countButtons>3</countButtons>
		</mouse>
		<systemBlock>
			<name>name system block here</name>
			<width>0.0</width>
			<height>0.0</height>
			<weigth>0.0</weigth>
			<innerSystemBlock>
				<motherboard>
					<name>name motherboard here</name>
					<formFactor>name form factor here</formFactor>
					<slots>6</slots>
					<connectors>4</connectors>
				</motherboard>
				<videoCard>
					<cpu>name cpu here</cpu>
					<coreClockSpeed>0.0</coreClockSpeed>
					<memoryType>name memoryType here</memoryType>
					<memorySize>4</memorySize>
				</videoCard>
			</innerSystemBlock>
		</systemBlock>
	</computer>
	<computer>
		<monitor>
			<width>0.0</width>
			<height>0.0</height>
			<name>name monitor here 2</name>
		</monitor>
		<keyboard>
			<name>name keyboard here</name>
			<countKeys>140</countKeys>
		</keyboard>
		<mouse>
			<name>name mouse here</name>
			<isWireless>0</isWireless>
			<countButtons>3</countButtons>
		</mouse>
		<systemBlock>
			<name>name system block here</name>
			<width>0.0</width>
			<height>0.0</height>
			<weigth>0.0</weigth>
			<innerSystemBlock>
				<motherboard>
					<name>name motherboard here</name>
					<formFactor>name form factor here</formFactor>
					<slots>6</slots>
					<connectors>4</connectors>
				</motherboard>
				<videoCard>
					<cpu>name cpu here</cpu>
					<coreClockSpeed>0.0</coreClockSpeed>
					<memoryType>name memoryType here</memoryType>
					<memorySize>4</memorySize>
				</videoCard>
			</innerSystemBlock>
		</systemBlock>
	</computer>
	<computer>
		<monitor>
			<width>0.0</width>
			<height>0.0</height>
			<name>name monitor here 2</name>
		</monitor>
		<keyboard>
			<name>name keyboard here</name>
			<countKeys>140</countKeys>
		</keyboard>
		<mouse>
			<name>name mouse here</name>
			<isWireless>0</isWireless>
			<countButtons>3</countButtons>
		</mouse>
		<systemBlock>
			<name>name system block here</name>
			<width>0.0</width>
			<height>0.0</height>
			<weigth>0.0</weigth>
			<innerSystemBlock>
				<motherboard>
					<name>name motherboard here</name>
					<formFactor>name form factor here</formFactor>
					<slots>6</slots>
					<connectors>4</connectors>
				</motherboard>
				<videoCard>
					<cpu>name cpu here</cpu>
					<coreClockSpeed>0.0</coreClockSpeed>
					<memoryType>name memoryType here</memoryType>
					<memorySize>4</memorySize>
				</videoCard>
			</innerSystemBlock>
		</systemBlock>
	</computer>
	<computer>
		<monitor>
			<width>0.0</width>
			<height>0.0</height>
			<name>name monitor here 2</name>
		</monitor>
		<keyboard>
			<name>name keyboard here</name>
			<countKeys>140</countKeys>
		</keyboard>
		<mouse>
			<name>name mouse here</name>
			<isWireless>0</isWireless>
			<countButtons>3</countButtons>
		</mouse>
		<systemBlock>
			<name>name system block here</name>
			<width>0.0</width>
			<height>0.0</height>
			<weigth>0.0</weigth>
			<innerSystemBlock>
				<motherboard>
					<name>name motherboard here</name>
					<formFactor>name form factor here</formFactor>
					<slots>6</slots>
					<connectors>4</connectors>
				</motherboard>
				<videoCard>
					<cpu>name cpu here</cpu>
					<coreClockSpeed>0.0</coreClockSpeed>
					<memoryType>name memoryType here</memoryType>
					<memorySize>4</memorySize>
				</videoCard>
			</innerSystemBlock>
		</systemBlock>
	</computer>
	<computer>
		<monitor>
			<width>0.0</width>
			<height>0.0</height>
			<name>name monitor here 2</name>
		</monitor>
		<keyboard>
			<name>name keyboard here</name>
			<countKeys>140</countKeys>
		</keyboard>
		<mouse>
			<name>name mouse here</name>
			<isWireless>0</isWireless>
			<countButtons>3</countButtons>
		</mouse>
		<systemBlock>
			<name>name system block here</name>
			<width>0.0</width>
			<height>0.0</height>
			<weigth>0.0</weigth>
			<innerSystemBlock>
				<motherboard>
					<name>name motherboard here</name>
					<formFactor>name form factor here</formFactor>
					<slots>6</slots>
					<connectors>4</connectors>
				</motherboard>
				<videoCard>
					<cpu>name cpu here</cpu>
					<coreClockSpeed>0.0</coreClockSpeed>
					<memoryType>name memoryType here</memoryType>